key_en,key_zh,key_vi,key_id,en,zh,vi,id,image_url,source_url
1.train-find,1.train-规划行程,1.train-len-ke-hoach,1.train-rencana,Plan your train: use PTV Journey Planner for next services and platform info.,规划火车行程：用 PTV 行程规划查看下一班次与站台信息。,Lên kế hoạch tàu: dùng PTV Journey Planner để xem chuyến kế tiếp và sân ga.,Rencanakan kereta: gunakan PTV Journey Planner untuk layanan berikutnya dan info peron.,https://www.danielbowen.com/uploads/2016/12/rail-map-2017.jpg,https://transport.vic.gov.au/journey
2.train-touchon,2.train-进站刷卡,2.train-cham-the-vao,2.train-tap-masuk,At the station gates: touch on with myki to enter.,在车站闸机：用 myki 刷卡进站。,Tại cổng ga: chạm thẻ myki để vào.,Di gerbang stasiun: ketuk myki untuk masuk.,https://www.audit.vic.gov.au/reportAssets/20150610-myki/img1.png,https://transport.vic.gov.au/tickets-and-myki/myki/tap-on-and-off-with-myki
3.train-platform,3.train-站台等待,3.train-san-ga,3.train-peron,On the platform: wait behind the yellow line and watch screens for your train.,在站台：在黄线后等待，并查看屏幕上的列车信息。,Tại sân ga: chờ sau vạch vàng và xem màn hình thông tin tàu.,Di peron: tunggu di belakang garis kuning dan lihat layar informasi kereta.,https://i.redd.it/681kcr39ssp21.jpg,https://transport.vic.gov.au/journey
4.train-board,4.train-上车,4.train-len-tau,4.train-naik,"When train arrives: let passengers off first, then board carefully.",列车到站：先让乘客下，再小心上车。,Khi tàu đến: nhường người xuống trước rồi hãy lên.,"Saat kereta datang: dahulukan penumpang turun, lalu naik dengan hati‑hati.",https://live-production.wcms.abc-cdn.net.au/02371bb4e8ca9222705dd0128e3762d1?impolicy=wcms_crop_resize&cropH=920&cropW=1382&xPos=0&yPos=19&width=862&height=575,https://transport.vic.gov.au/languages-hub/public-transport-translated-information
5.train-seating,5.train-座位礼仪,5.train-ngoi-giu-gin,5.train-tempat-duduk,Find a seat or hold the rail; keep bags off spare seats.,找到座位或握住扶手；不要用包占座。,Tìm chỗ ngồi hoặc bám tay vịn; không chiếm ghế bằng túi xách.,Cari tempat duduk atau pegang pegangan; jangan menaruh tas di kursi kosong.,https://scontent.fmel18-1.fna.fbcdn.net/v/t39.30808-6/481789355_969996285319462_7746311165382935677_n.jpg?stp=dst-jpg_p526x296_tt6&_nc_cat=101&ccb=1-7&_nc_sid=127cfc&_nc_ohc=PHOCFGgQP7IQ7kNvwHDHEuK&_nc_oc=AdnEk8jv5tkaj20PtgryheZGPq01UjetJRsOhUTKr6WcZTjrHyY-QjF3RnXczuMfoipeVuakvEdrZ5oLLXA9r3kh&_nc_zt=23&_nc_ht=scontent.fmel18-1.fna&_nc_gid=fjGaOZaDEo6NnfQxa9FbCA&oh=00_AfbOOjJuzh7P81CRBQp_lnjPt3c_C4H6dq4Wuwz1CiWesA&oe=68D1C196,https://transport.vic.gov.au/languages-hub/public-transport-translated-information
6.train-getoff,6.train-getoff,6.train-getoff,6.train-getoff,At your stop: alight carefully and follow the exit signs.,到站：小心下车，按指示牌前往出口。,Đến ga của bạn: xuống tàu cẩn thận và theo biển chỉ dẫn lối ra.,Di stasiun tujuan: turun dengan hati‑hati dan ikuti tanda keluar.,https://ds12k1658w1f2.cloudfront.net/wp-content/uploads/2020/12/safety-zone.jpg,https://transport.vic.gov.au/journey
7.train-touchoff,7.train-touchoff,7.train-touchoff,7.train-touchoff,Exit gates: touch off with myki to finish your trip.,出站闸机：刷卡出站，结束行程。,Cổng ra: chạm thẻ để kết thúc chuyến đi.,Gerbang keluar: ketuk kartu untuk mengakhiri perjalanan.,https://encrypted-tbn0.gstatic.com/images?q=tbn:ANd9GcRlbG-bEPsIQkhC2qDuE6GG7VPiaNhjeNy_iA&s,https://transport.vic.gov.au/tickets-and-myki/myki/tap-on-and-off-with-myki
8.train-print,8.train-print,8.train-print,8.train-print,Official PDFs (multi‑language) for printing: how to travel by train in Victoria.,官方多语言 PDF（可打印）：在维州乘坐火车指南。,PDF chính thức đa ngôn ngữ để in: hướng dẫn đi tàu ở Victoria.,PDF resmi multi‑bahasa untuk dicetak: panduan naik kereta di Victoria.,,https://transport.vic.gov.au/languages-hub/public-transport-translated-information
