key,title,en,image,link
trainfind,1.train find,Plan your train: use PTV Journey Planner for next services and platform info.,https://www.danielbowen.com/uploads/2016/12/rail-map-2017.jpg,https://transport.vic.gov.au/journey
traintouchon,2.train touchon,At the station gates: touch on with myki to enter.,https://www.audit.vic.gov.au/reportAssets/20150610-myki/img1.png,https://transport.vic.gov.au/tickets-and-myki/myki/tap-on-and-off-with-myki
trainplatform,3.train platform,On the platform: wait behind the yellow line and watch screens for your train.,https://i.redd.it/681kcr39ssp21.jpg,https://transport.vic.gov.au/journey
trainboard,4.train board,"When train arrives: let passengers off first, then board carefully.",https://live-production.wcms.abc-cdn.net.au/02371bb4e8ca9222705dd0128e3762d1?impolicy=wcms_crop_resize&cropH=920&cropW=1382&xPos=0&yPos=19&width=862&height=575,https://transport.vic.gov.au/languages-hub/public-transport-translated-information
trainseating,5.train seating,Find a seat or hold the rail; keep bags off spare seats.,https://scontent.fmel18-1.fna.fbcdn.net/v/t39.30808-6/481789355_969996285319462_7746311165382935677_n.jpg?stp=dst-jpg_p526x296_tt6&_nc_cat=101&ccb=1-7&_nc_sid=127cfc&_nc_ohc=PHOCFGgQP7IQ7kNvwHDHEuK&_nc_oc=AdnEk8jv5tkaj20PtgryheZGPq01UjetJRsOhUTKr6WcZTjrHyY-QjF3RnXczuMfoipeVuakvEdrZ5oLLXA9r3kh&_nc_zt=23&_nc_ht=scontent.fmel18-1.fna&_nc_gid=fjGaOZaDEo6NnfQxa9FbCA&oh=00_AfbOOjJuzh7P81CRBQp_lnjPt3c_C4H6dq4Wuwz1CiWesA&oe=68D1C196,https://transport.vic.gov.au/languages-hub/public-transport-translated-information
traingetoff,6.train getoff,At your stop: alight carefully and follow the exit signs.,https://ds12k1658w1f2.cloudfront.net/wp-content/uploads/2020/12/safety-zone.jpg,https://transport.vic.gov.au/journey
traintouchoff,7.train touchoff,Exit gates: touch off with myki to finish your trip.,https://encrypted-tbn0.gstatic.com/images?q=tbn:ANd9GcRlbG-bEPsIQkhC2qDuE6GG7VPiaNhjeNy_iA&s,https://transport.vic.gov.au/tickets-and-myki/myki/tap-on-and-off-with-myki
trainprint,8.train print,Official PDFs (multi‑language) for printing: how to travel by train in Victoria.,http://pic.xlhs.com/up/2022-11/202211141454407873.png,https://transport.vic.gov.au/languages-hub/public-transport-translated-information
