key,title,en,image,link
tramfind,How to Find Your Tram,"Use the PTV Journey Planner or TramTracker app to find your tram. Enter your location and destination to see real-time arrivals. This helps you plan the best route for your trip.",https://i.ytimg.com/vi/DsytqMOxL-0/maxresdefault.jpg,https://play.google.com/store/apps/details?id=com.yarratrams.tramtracker
tramroutenumber,Check Tram Route Number,"At the tram stop, confirm the route number and destination shown on the tram. Make sure you are waiting for the correct tram. This helps you board the right service for your journey.",https://railgallery.wongm.com/cache/night-network-melbourne/F113_2797_595.jpg?cached=1744707189,https://transport.vic.gov.au/journey
tramfreezone,Free Tram Zone Rules,"Inside Melbourne’s Free Tram Zone, you don’t need to touch on with your Myki card. Outside the zone, you must touch on before boarding. These rules help you avoid unnecessary charges and fines.",https://abley.com/hs-fs/hubfs/Melbourne%20Free%20Tram%20Zone.jpg?width=931&height=614&name=Melbourne%20Free%20Tram%20Zone.jpg,https://www.ptv.vic.gov.au/assets/PDFs/Maps/Network-maps/5b4a3efe80/PTV-Free-Tram-Zone-Map.pdf
tramboard,Boarding the Tram,"Board the tram when it is safe and stand clear of the doors. Hold a rail if you are standing during your trip. This helps keep you safe while travelling.",https://live.staticflickr.com/65535/51115298111_a4cff232be_c.jpg,https://transport.vic.gov.au/languages-hub/public-transport-translated-information
tramtouch,Touching On and Off on Trams,"On trams, you don’t need to touch off at the end of your journey. Only touch on when you are outside the Free Tram Zone. This ensures you pay the correct fare.",https://www.shutterstock.com/image-photo/sign-denoting-end-free-tram-260nw-1536378902.jpg,https://transport.vic.gov.au/tickets-and-myki/myki/tap-on-and-off-with-myki
tramstopbtn,Requesting Your Tram Stop,"Press the stop button before your stop and wait for the tram to stop fully. This lets the driver know you want to get off. Always prepare to leave a few moments before your stop.",https://wordpress.meldmagazine.com.au/wp-content/uploads/2019/03/Handicap-Section.jpg.webp,https://transport.vic.gov.au/languages-hub/public-transport-translated-information
tramalight,Getting Off the Tram,"Alight carefully at your stop and watch for bikes and cars around the safety zone. Follow the signs to exit safely. This helps you leave the tram without accidents.",https://www.racv.com.au/royalauto/news/community/getting-kids-to-school-safely-guide/_jcr_content/root/container/articlepagecontent/content/image.coreimg.jpeg/1737608853117/1200x675-traffic-directive-tram-1124.jpeg,https://transport.vic.gov.au/plan-a-journey/maps/melbourne-public-transport-maps
tramprint,Printable Tram Guides,"Official tram guides are available as PDFs in multiple languages. These guides explain how to travel by tram in Victoria. Download and print them for easy reference.",http://pic.xlhs.com/up/2022-11/202211141454407873.png,https://transport.vic.gov.au/languages-hub/public-transport-translated-information
